{
  "schemaVersion": 1,
  "id": "nonprofit-2026-official",
  "version": "2026.10.25.1",
  "regime": "Nonprofit",
  "displayName": "民非2026：正式56项一级科目快照",
  "legalStatus": "OfficialCurrent",
  "legalEffectiveFrom": "2026-01-01",
  "supportedPeriodsFrom": "2026-01-01",
  "effectiveUntil": null,
  "isVerifiedForProduction": false,
  "scope": {
    "description": "境内依法设立，同时具备非营利目的、资源提供者不取得经济回报且不保留或享有财产权利三特征；财政部门另有规定从其规定。",
    "includedProfiles": [
      "EligibleNonprofit"
    ],
    "exclusions": [
      "行政事业单位不因名称为非营利自动适用",
      "行业、地方及慈善监管专用规则未覆盖"
    ],
    "requiresHumanEligibilityReview": true
  },
  "coverage": {
    "firstLevelAccounts": "CompleteOfficialBaseSnapshot",
    "officialBaseCount": 56,
    "allCurrentRequirementsCovered": false,
    "reports": "MetadataAndRepresentativeRows",
    "migration": "PartialEvidenceOnly"
  },
  "sourceRefs": [
    {
      "sourceId": "nonprofit-standard",
      "locator": "第2、67—79、94—95条；PDF第47—49页"
    }
  ],
  "accounts": [
    {
      "id": "np26-1001",
      "code": "1001",
      "name": "现金",
      "parentCode": null,
      "category": "Asset",
      "normalDirection": "Debit",
      "normalDirectionIsExclusive": false,
      "isContra": false,
      "origin": "OfficialFirstLevel",
      "ordinal": 1,
      "restrictionPolicy": "NotApplicable",
      "nameVerification": "OfficialTable",
      "sourceRefs": [
        {
          "sourceId": "nonprofit-standard",
          "locator": "PDF第47页，序号1；科目说明始于第50页"
        }
      ],
      "notes": []
    },
    {
      "id": "np26-1002",
      "code": "1002",
      "name": "银行存款",
      "parentCode": null,
      "category": "Asset",
      "normalDirection": "Debit",
      "normalDirectionIsExclusive": false,
      "isContra": false,
      "origin": "OfficialFirstLevel",
      "ordinal": 2,
      "restrictionPolicy": "NotApplicable",
      "nameVerification": "OfficialTable",
      "sourceRefs": [
        {
          "sourceId": "nonprofit-standard",
          "locator": "PDF第47页，序号2；科目说明始于第51页"
        }
      ],
      "notes": []
    },
    {
      "id": "np26-1009",
      "code": "1009",
      "name": "其他货币资金",
      "parentCode": null,
      "category": "Asset",
      "normalDirection": "Debit",
      "normalDirectionIsExclusive": false,
      "isContra": false,
      "origin": "OfficialFirstLevel",
      "ordinal": 3,
      "restrictionPolicy": "NotApplicable",
      "nameVerification": "OfficialTable",
      "sourceRefs": [
        {
          "sourceId": "nonprofit-standard",
          "locator": "PDF第47页，序号3；科目说明始于第56页"
        }
      ],
      "notes": []
    },
    {
      "id": "np26-1101",
      "code": "1101",
      "name": "短期投资",
      "parentCode": null,
      "category": "Asset",
      "normalDirection": "Debit",
      "normalDirectionIsExclusive": false,
      "isContra": false,
      "origin": "OfficialFirstLevel",
      "ordinal": 4,
      "restrictionPolicy": "NotApplicable",
      "nameVerification": "OfficialTable",
      "sourceRefs": [
        {
          "sourceId": "nonprofit-standard",
          "locator": "PDF第47页，序号4；科目说明始于第59页"
        }
      ],
      "notes": []
    },
    {
      "id": "np26-1102",
      "code": "1102",
      "name": "短期投资跌价准备",
      "parentCode": null,
      "category": "Asset",
      "normalDirection": "Credit",
      "normalDirectionIsExclusive": false,
      "isContra": true,
      "origin": "OfficialFirstLevel",
      "ordinal": 5,
      "restrictionPolicy": "NotApplicable",
      "nameVerification": "OfficialTable",
      "sourceRefs": [
        {
          "sourceId": "nonprofit-standard",
          "locator": "PDF第47页，序号5；科目说明始于第61页"
        }
      ],
      "notes": [
        "Contra-asset: credit balance; do not infer direction from asset category."
      ]
    },
    {
      "id": "np26-1111",
      "code": "1111",
      "name": "应收票据",
      "parentCode": null,
      "category": "Asset",
      "normalDirection": "Debit",
      "normalDirectionIsExclusive": false,
      "isContra": false,
      "origin": "OfficialFirstLevel",
      "ordinal": 6,
      "restrictionPolicy": "NotApplicable",
      "nameVerification": "OfficialTable",
      "sourceRefs": [
        {
          "sourceId": "nonprofit-standard",
          "locator": "PDF第47页，序号6；科目说明始于第62页"
        }
      ],
      "notes": []
    },
    {
      "id": "np26-1121",
      "code": "1121",
      "name": "应收账款",
      "parentCode": null,
      "category": "Asset",
      "normalDirection": "Debit",
      "normalDirectionIsExclusive": false,
      "isContra": false,
      "origin": "OfficialFirstLevel",
      "ordinal": 7,
      "restrictionPolicy": "NotApplicable",
      "nameVerification": "OfficialTable",
      "sourceRefs": [
        {
          "sourceId": "nonprofit-standard",
          "locator": "PDF第47页，序号7；科目说明始于第64页"
        }
      ],
      "notes": []
    },
    {
      "id": "np26-1122",
      "code": "1122",
      "name": "其他应收款",
      "parentCode": null,
      "category": "Asset",
      "normalDirection": "Debit",
      "normalDirectionIsExclusive": false,
      "isContra": false,
      "origin": "OfficialFirstLevel",
      "ordinal": 8,
      "restrictionPolicy": "NotApplicable",
      "nameVerification": "OfficialTable",
      "sourceRefs": [
        {
          "sourceId": "nonprofit-standard",
          "locator": "PDF第47页，序号8；科目说明始于第65页"
        }
      ],
      "notes": []
    },
    {
      "id": "np26-1131",
      "code": "1131",
      "name": "坏账准备",
      "parentCode": null,
      "category": "Asset",
      "normalDirection": "Credit",
      "normalDirectionIsExclusive": false,
      "isContra": true,
      "origin": "OfficialFirstLevel",
      "ordinal": 9,
      "restrictionPolicy": "NotApplicable",
      "nameVerification": "OfficialTable",
      "sourceRefs": [
        {
          "sourceId": "nonprofit-standard",
          "locator": "PDF第47页，序号9；科目说明始于第67页"
        }
      ],
      "notes": [
        "Contra-asset: credit balance; do not infer direction from asset category."
      ]
    },
    {
      "id": "np26-1141",
      "code": "1141",
      "name": "预付账款",
      "parentCode": null,
      "category": "Asset",
      "normalDirection": "Debit",
      "normalDirectionIsExclusive": false,
      "isContra": false,
      "origin": "OfficialFirstLevel",
      "ordinal": 10,
      "restrictionPolicy": "NotApplicable",
      "nameVerification": "OfficialTable",
      "sourceRefs": [
        {
          "sourceId": "nonprofit-standard",
          "locator": "PDF第47页，序号10；科目说明始于第68页"
        }
      ],
      "notes": []
    },
    {
      "id": "np26-1201",
      "code": "1201",
      "name": "存货",
      "parentCode": null,
      "category": "Asset",
      "normalDirection": "Debit",
      "normalDirectionIsExclusive": false,
      "isContra": false,
      "origin": "OfficialFirstLevel",
      "ordinal": 11,
      "restrictionPolicy": "NotApplicable",
      "nameVerification": "OfficialTable",
      "sourceRefs": [
        {
          "sourceId": "nonprofit-standard",
          "locator": "PDF第47页，序号11；科目说明始于第69页"
        }
      ],
      "notes": []
    },
    {
      "id": "np26-1202",
      "code": "1202",
      "name": "存货跌价准备",
      "parentCode": null,
      "category": "Asset",
      "normalDirection": "Credit",
      "normalDirectionIsExclusive": false,
      "isContra": true,
      "origin": "OfficialFirstLevel",
      "ordinal": 12,
      "restrictionPolicy": "NotApplicable",
      "nameVerification": "OfficialTable",
      "sourceRefs": [
        {
          "sourceId": "nonprofit-standard",
          "locator": "PDF第47页，序号12；科目说明始于第71页"
        }
      ],
      "notes": [
        "Contra-asset: credit balance; do not infer direction from asset category."
      ]
    },
    {
      "id": "np26-1301",
      "code": "1301",
      "name": "待摊费用",
      "parentCode": null,
      "category": "Asset",
      "normalDirection": "Debit",
      "normalDirectionIsExclusive": false,
      "isContra": false,
      "origin": "OfficialFirstLevel",
      "ordinal": 13,
      "restrictionPolicy": "NotApplicable",
      "nameVerification": "OfficialTable",
      "sourceRefs": [
        {
          "sourceId": "nonprofit-standard",
          "locator": "PDF第47页，序号13；科目说明始于第72页"
        }
      ],
      "notes": []
    },
    {
      "id": "np26-1401",
      "code": "1401",
      "name": "长期股权投资",
      "parentCode": null,
      "category": "Asset",
      "normalDirection": "Debit",
      "normalDirectionIsExclusive": false,
      "isContra": false,
      "origin": "OfficialFirstLevel",
      "ordinal": 14,
      "restrictionPolicy": "NotApplicable",
      "nameVerification": "OfficialTable",
      "sourceRefs": [
        {
          "sourceId": "nonprofit-standard",
          "locator": "PDF第47页，序号14；科目说明始于第73页"
        }
      ],
      "notes": []
    },
    {
      "id": "np26-1402",
      "code": "1402",
      "name": "长期债权投资",
      "parentCode": null,
      "category": "Asset",
      "normalDirection": "Debit",
      "normalDirectionIsExclusive": false,
      "isContra": false,
      "origin": "OfficialFirstLevel",
      "ordinal": 15,
      "restrictionPolicy": "NotApplicable",
      "nameVerification": "OfficialTable",
      "sourceRefs": [
        {
          "sourceId": "nonprofit-standard",
          "locator": "PDF第47页，序号15；科目说明始于第75页"
        }
      ],
      "notes": []
    },
    {
      "id": "np26-1403",
      "code": "1403",
      "name": "其他长期投资",
      "parentCode": null,
      "category": "Asset",
      "normalDirection": "Debit",
      "normalDirectionIsExclusive": false,
      "isContra": false,
      "origin": "OfficialFirstLevel",
      "ordinal": 16,
      "restrictionPolicy": "NotApplicable",
      "nameVerification": "OfficialTable",
      "sourceRefs": [
        {
          "sourceId": "nonprofit-standard",
          "locator": "PDF第47页，序号16；科目说明始于第77页"
        }
      ],
      "notes": []
    },
    {
      "id": "np26-1421",
      "code": "1421",